<?xml version="1.0" encoding="UTF-8"?>
<!DOCTYPE Estudiantes SYSTEM "estudiantes.dtd"> 
<Estudiante xmlns="http://www.w3schools.com"
xmlns:xsi="http://www.w3.org/2001/XMLSchema-instance"
xsi:schemaLocation="estudiantes.xsd">
  <cedula>1724170152</cedula>
  <nombre>Andres</nombre>
  <masculino>true</masculino>
  <fechaNacimiento>2002-09-24</fechaNacimiento>
  <ingresos>19.29</ingresos>
  <asignaturas>
      <asignatura>
        <codigo>1</codigo>
        <nombre>Arquitectura</nombre>
        <creditos>4</creditos>
        <aulas>
          <aula>
            <codigo>A1</codigo>
            <ubicacion>BLOQUE H200</ubicacion>
          </aula>
        </aulas>
      </asignatura>
  </asignaturas>  
</Estudiante>